{
  "sourceAdapterIntakeId": "sourceadapterintake-1301",
  "generatedAt": "2026-06-10T04:20:00Z",
  "domain": "weather-logistics",
  "intakeMode": "external_adapter_output_to_checked_intake",
  "contractBindings": {
    "sourceAdapterOutputSchema": "spec/source-adapter-output.schema.json",
    "sourceManifestSchema": "spec/source-manifest.schema.json",
    "fieldMappingSchema": "spec/field-mapping.schema.json",
    "sourceIntakeReportSchema": "spec/source-intake-report.schema.json",
    "setupBenchmarkGateSchema": "spec/setup-benchmark-gate.schema.json",
    "setupMethodDecisionSchema": "spec/setup-method-decision.schema.json",
    "existingTransitAdapterOutputPath": "spec/fixtures/generated/source-adapter-output/weather-transit-delays-source-adapter-output.generated.json"
  },
  "intakeCases": [
    {
      "caseId": "sourceadapterintakecase-1301",
      "case": "accepted",
      "sourceAdapterOutputId": "sourceadapteroutput-1301",
      "sourceAdapterOutputPath": "spec/fixtures/generated/source-adapter-intake/weather-logistics-accepted-source-adapter-output.generated.json",
      "outputStatus": "intake_ready",
      "sourceKind": "agent_extraction",
      "implementationLocation": "external_agent",
      "executionMode": "external_runtime_capture",
      "validationSummary": {
        "sourceAdapterOutputSchemaValid": true,
        "manifestValid": true,
        "fieldMappingValid": true,
        "provenanceSummaryValid": true,
        "sourceRolesValid": true,
        "freshnessValid": true,
        "leakageStatus": "passed",
        "credentialBoundaryStatus": "passed",
        "rawRowsIncluded": false,
        "allEvidenceClaimed": false
      },
      "intakeRoute": {
        "canEnterSourceIntake": true,
        "sourceIntakeReportId": "sourceintakereport-1301",
        "sourceIntakeStatus": "accepted",
        "adapterIntakeStatus": "accepted",
        "nextAction": "proceed_to_method_gating"
      },
      "methodGateSummary": {
        "setupBenchmarkGateId": "setupbenchmarkgate-1301",
        "setupMethodDecisionId": "setupmethoddecision-1301",
        "methodGateStatus": "method_selected",
        "selectedMethodClass": "deterministic_statistical",
        "forecastArtifactsCreated": false,
        "qualityClaimAllowed": false
      },
      "generatedArtifacts": {
        "sourceAdapterOutput": "spec/fixtures/generated/source-adapter-intake/weather-logistics-accepted-source-adapter-output.generated.json",
        "sourceIntakeReport": "spec/fixtures/generated/source-adapter-intake/weather-logistics-accepted-source-intake-report.generated.json",
        "setupBenchmarkGate": "spec/fixtures/generated/source-adapter-intake/weather-logistics-accepted-setup-benchmark-gate.generated.json",
        "setupMethodDecision": "spec/fixtures/generated/source-adapter-intake/weather-logistics-accepted-setup-method-decision.generated.json"
      },
      "rejectionReasons": [],
      "requiredActions": [
        "Proceed to checked setup method gate before forecast execution."
      ]
    },
    {
      "caseId": "sourceadapterintakecase-1302",
      "case": "needs_confirmation",
      "sourceAdapterOutputId": "sourceadapteroutput-1302",
      "sourceAdapterOutputPath": "spec/fixtures/generated/source-adapter-intake/weather-logistics-needs-confirmation-source-adapter-output.generated.json",
      "outputStatus": "needs_confirmation",
      "sourceKind": "agent_extraction",
      "implementationLocation": "external_agent",
      "executionMode": "external_runtime_capture",
      "validationSummary": {
        "sourceAdapterOutputSchemaValid": true,
        "manifestValid": true,
        "fieldMappingValid": true,
        "provenanceSummaryValid": true,
        "sourceRolesValid": true,
        "freshnessValid": true,
        "leakageStatus": "passed",
        "credentialBoundaryStatus": "passed",
        "rawRowsIncluded": false,
        "allEvidenceClaimed": false
      },
      "intakeRoute": {
        "canEnterSourceIntake": true,
        "sourceIntakeReportId": "sourceintakereport-1302",
        "sourceIntakeStatus": "needs_confirmation",
        "adapterIntakeStatus": "needs_confirmation",
        "nextAction": "ask_mapping_confirmation"
      },
      "methodGateSummary": {
        "setupBenchmarkGateId": "setupbenchmarkgate-1302",
        "setupMethodDecisionId": "setupmethoddecision-1302",
        "methodGateStatus": "needs_mapping_confirmation",
        "selectedMethodClass": "none",
        "forecastArtifactsCreated": false,
        "qualityClaimAllowed": false
      },
      "generatedArtifacts": {
        "sourceAdapterOutput": "spec/fixtures/generated/source-adapter-intake/weather-logistics-needs-confirmation-source-adapter-output.generated.json",
        "sourceIntakeReport": "spec/fixtures/generated/source-adapter-intake/weather-logistics-needs-confirmation-source-intake-report.generated.json",
        "setupBenchmarkGate": "spec/fixtures/generated/source-adapter-intake/weather-logistics-needs-confirmation-setup-benchmark-gate.generated.json",
        "setupMethodDecision": "spec/fixtures/generated/source-adapter-intake/weather-logistics-needs-confirmation-setup-method-decision.generated.json"
      },
      "rejectionReasons": [
        "agent_inferred_mapping",
        "mapping_requires_confirmation"
      ],
      "requiredActions": [
        "Confirm agent-inferred field and alias mappings before method selection."
      ]
    },
    {
      "caseId": "sourceadapterintakecase-1303",
      "case": "insufficient_data",
      "sourceAdapterOutputId": "sourceadapteroutput-1303",
      "sourceAdapterOutputPath": "spec/fixtures/generated/source-adapter-intake/weather-logistics-insufficient-data-source-adapter-output.generated.json",
      "outputStatus": "intake_ready",
      "sourceKind": "agent_extraction",
      "implementationLocation": "external_agent",
      "executionMode": "external_runtime_capture",
      "validationSummary": {
        "sourceAdapterOutputSchemaValid": true,
        "manifestValid": true,
        "fieldMappingValid": true,
        "provenanceSummaryValid": true,
        "sourceRolesValid": true,
        "freshnessValid": true,
        "leakageStatus": "passed",
        "credentialBoundaryStatus": "passed",
        "rawRowsIncluded": false,
        "allEvidenceClaimed": false
      },
      "intakeRoute": {
        "canEnterSourceIntake": true,
        "sourceIntakeReportId": "sourceintakereport-1303",
        "sourceIntakeStatus": "rejected",
        "adapterIntakeStatus": "insufficient_data",
        "nextAction": "collect_more_data"
      },
      "methodGateSummary": {
        "setupBenchmarkGateId": "setupbenchmarkgate-1303",
        "setupMethodDecisionId": "setupmethoddecision-1303",
        "methodGateStatus": "needs_more_data",
        "selectedMethodClass": "none",
        "forecastArtifactsCreated": false,
        "qualityClaimAllowed": false
      },
      "generatedArtifacts": {
        "sourceAdapterOutput": "spec/fixtures/generated/source-adapter-intake/weather-logistics-insufficient-data-source-adapter-output.generated.json",
        "sourceIntakeReport": "spec/fixtures/generated/source-adapter-intake/weather-logistics-insufficient-data-source-intake-report.generated.json",
        "setupBenchmarkGate": "spec/fixtures/generated/source-adapter-intake/weather-logistics-insufficient-data-setup-benchmark-gate.generated.json",
        "setupMethodDecision": "spec/fixtures/generated/source-adapter-intake/weather-logistics-insufficient-data-setup-method-decision.generated.json"
      },
      "rejectionReasons": [
        "all_required_fields_mapped",
        "available_before_forecast_close",
        "entity_scope_matches",
        "insufficient_comparable_rows",
        "insufficient_positive_outcomes",
        "no_post_outcome_evidence_detected",
        "privacy_boundary_ok",
        "source_fresh_enough",
        "types_compatible"
      ],
      "requiredActions": [
        "Collect more comparable historical rows and positive outcomes before method selection."
      ]
    },
    {
      "caseId": "sourceadapterintakecase-1304",
      "case": "rejected",
      "sourceAdapterOutputId": "sourceadapteroutput-1304",
      "sourceAdapterOutputPath": "spec/fixtures/generated/source-adapter-intake/weather-logistics-rejected-source-adapter-output.generated.json",
      "outputStatus": "rejected",
      "sourceKind": "agent_extraction",
      "implementationLocation": "external_agent",
      "executionMode": "external_runtime_capture",
      "validationSummary": {
        "sourceAdapterOutputSchemaValid": true,
        "manifestValid": true,
        "fieldMappingValid": true,
        "provenanceSummaryValid": true,
        "sourceRolesValid": true,
        "freshnessValid": false,
        "leakageStatus": "failed",
        "credentialBoundaryStatus": "passed",
        "rawRowsIncluded": false,
        "allEvidenceClaimed": false
      },
      "intakeRoute": {
        "canEnterSourceIntake": true,
        "sourceIntakeReportId": "sourceintakereport-1304",
        "sourceIntakeStatus": "rejected",
        "adapterIntakeStatus": "rejected",
        "nextAction": "replace_source"
      },
      "methodGateSummary": {
        "setupBenchmarkGateId": "setupbenchmarkgate-1304",
        "setupMethodDecisionId": "setupmethoddecision-1304",
        "methodGateStatus": "rejected",
        "selectedMethodClass": "none",
        "forecastArtifactsCreated": false,
        "qualityClaimAllowed": false
      },
      "generatedArtifacts": {
        "sourceAdapterOutput": "spec/fixtures/generated/source-adapter-intake/weather-logistics-rejected-source-adapter-output.generated.json",
        "sourceIntakeReport": "spec/fixtures/generated/source-adapter-intake/weather-logistics-rejected-source-intake-report.generated.json",
        "setupBenchmarkGate": "spec/fixtures/generated/source-adapter-intake/weather-logistics-rejected-setup-benchmark-gate.generated.json",